{
  "$schema": "https://json-schema.org/draft/2020-12/schema",
  "$id": "https://narrative-adventure.local/schemas/level-data.schema.json",
  "title": "Level data",
  "description": "One playable location. Everything a level needs that is not code: where the player starts, where the puzzle markers are, which reusable puzzle type each marker opens, and which precomputed astronomy data it reads.",
  "type": "object",
  "required": ["id", "displayName", "mode", "unlockThreshold", "companionTiers", "map", "markers"],
  "additionalProperties": false,
  "properties": {
    "id": {
      "type": "string",
      "pattern": "^[a-z][a-z0-9-]*$",
      "description": "Stable level id, kebab-case. Used as the localStorage progress key."
    },
    "displayName": {
      "$ref": "#/$defs/contentKey",
      "description": "Content key, never literal text. Bulgarian strings live in content/bg/."
    },
    "mode": {
      "enum": ["guided", "open"],
      "description": "guided = linear tutorial (Earth, Moon). open = free exploration with scattered markers."
    },
    "unlockThreshold": {
      "type": "number",
      "minimum": 0,
      "maximum": 1,
      "description": "Fraction of this level's REQUIRED markers that must be solved to unlock the next page — solved intersected with required, so optional markers can never carry a level on their own. 1.0 for guided levels, 0.7 for open ones — the brief's forgiving gate, kept as data so both kinds share one code path."
    },
    "companionTiers": {
      "enum": [2, 3],
      "description": "How many tiers the companion speaks in on this level. 3 = arrival (naming the goal, when a puzzle opens), nudge (on a stall), fact (on success): Earth. 2 = nudge and fact: the Moon, Mars, Jupiter and Saturn (v1-spec :27-29). Level data, not a branch in code, the same seam as unlockThreshold (owner, 2026-10-07)."
    },
    "map": {
      "type": "object",
      "required": ["width", "height", "spawn"],
      "additionalProperties": false,
      "properties": {
        "width": { "type": "integer", "minimum": 1 },
        "height": { "type": "integer", "minimum": 1 },
        "spawn": { "$ref": "#/$defs/point" }
      }
    },
    "markers": {
      "type": "array",
      "minItems": 1,
      "description": "Puzzle stations. The brief calls for roughly 3-4 per level.",
      "items": { "$ref": "#/$defs/marker" }
    }
  },
  "$defs": {
    "contentKey": {
      "type": "string",
      "pattern": "^[a-z][a-z0-9.-]*$",
      "description": "ASCII key resolved through src/shared/content.ts. A literal Cyrillic string here is a bug."
    },
    "point": {
      "type": "object",
      "required": ["x", "y"],
      "additionalProperties": false,
      "properties": {
        "x": { "type": "number" },
        "y": { "type": "number" }
      }
    },
    "rotateMatchConfig": {
      "type": "object",
      "required": ["renderer", "drives", "targets", "tolerance"],
      "additionalProperties": false,
      "description": "The one engine that exists. Four Earth beats reskin it — sundial, day/night spin, seasons tilt, moon phase — so its config is pinned here rather than left free-form. One engine, four renderers: `renderer` says which reskin is drawn and `drives` says which angle the child's drag actually changes. Both are closed vocabularies, and neither contains a bare 'rotation' — see the moon-phase branch below for why that matters.",
      "properties": {
        "renderer": {
          "enum": ["sundial", "day-night", "seasons-tilt", "moon-phase"],
          "description": "Which of the four reskins to draw. Closed for the same reason the puzzle-type list is closed: a renderer nobody built is a marker that opens to nothing."
        },
        "drives": {
          "enum": ["sunAngle", "spin", "tilt", "orbitAngle"],
          "description": "The quantity the child's drag changes. sunAngle = the Sun's apparent angle across the sky, which Earth's rotation is the cause of. spin = a body turning on its own axis. tilt = the axial tilt that causes seasons. orbitAngle = a body's position along its orbit. There is deliberately no generic 'rotation' value: it is the word the original Earth draft used for the moon-phase beat, and the Moon is tidally locked, so turning it produces no phase change at all.",
          "$comment": "camelCase values name a quantity in code; the renderer names are kebab-case because they name a reskin."
        },
        "targets": {
          "type": "integer",
          "minimum": 1,
          "description": "How many rounds the child plays before the marker is solved. Zero rounds would be solved before it is touched."
        },
        "tolerance": {
          "type": "number",
          "exclusiveMinimum": 0,
          "description": "How close counts as matched, in the renderer's own units. Must be positive — a zero tolerance demands an exact drag, which is the opposite of the brief's forgiving gate."
        }
      },
      "allOf": [
        {
          "if": {
            "required": ["renderer"],
            "properties": { "renderer": { "const": "moon-phase" } }
          },
          "then": {
            "properties": { "drives": { "const": "orbitAngle" } },
            "description": "Only the moon-phase renderer is pinned to a single quantity, because only this one carries a misconception if it is authored wrong. The Moon is tidally locked, so the lit fraction we see is Sun-Moon-observer geometry: the child moves the Moon around the Earth, and the phase follows. Authoring 'spin' here would teach that phases come from the Moon turning, which is the third live childhood misconception alongside seasons-by-distance and phases-by-Earth's-shadow. The other three renderers are left to the enum: their engines are not built yet and over-pinning a shape nobody has seen is the guess this schema exists to prevent."
          }
        }
      ]
    },
    "noEngineConfig": {
      "type": "object",
      "maxProperties": 0,
      "description": "No engine exists for this type yet, so no config shape is known. Absent or empty is the only honest value; guessing a shape now would pin a fiction. Whoever builds the engine replaces this ref with a real schema."
    },
    "marker": {
      "type": "object",
      "required": ["id", "position", "puzzle", "label"],
      "additionalProperties": false,
      "allOf": [
        {
          "if": {
            "required": ["puzzle"],
            "properties": { "puzzle": { "const": "rotate-match" } }
          },
          "then": {
            "required": ["config"],
            "properties": { "config": { "$ref": "#/$defs/rotateMatchConfig" } }
          }
        },
        {
          "if": {
            "required": ["puzzle"],
            "properties": { "puzzle": { "const": "connect-the-dots" } }
          },
          "then": { "properties": { "config": { "$ref": "#/$defs/noEngineConfig" } } }
        },
        {
          "if": {
            "required": ["puzzle"],
            "properties": { "puzzle": { "const": "parallax-compare" } }
          },
          "then": { "properties": { "config": { "$ref": "#/$defs/noEngineConfig" } } }
        },
        {
          "if": {
            "required": ["puzzle"],
            "properties": { "puzzle": { "const": "trajectory-match" } }
          },
          "then": { "properties": { "config": { "$ref": "#/$defs/noEngineConfig" } } }
        },
        {
          "if": {
            "required": ["puzzle"],
            "properties": { "puzzle": { "const": "telescope-focus" } }
          },
          "then": { "properties": { "config": { "$ref": "#/$defs/noEngineConfig" } } }
        }
      ],
      "properties": {
        "id": { "type": "string", "pattern": "^[a-z][a-z0-9-]*$" },
        "position": { "$ref": "#/$defs/point" },
        "puzzle": {
          "enum": [
            "rotate-match",
            "connect-the-dots",
            "parallax-compare",
            "trajectory-match",
            "telescope-focus"
          ],
          "description": "One of the five reusable puzzle types. Each is built once and reskinned per planet — a sixth value here means a one-off that needs its own maintenance forever, so it takes an ADR, never a drive-by edit."
        },
        "label": { "$ref": "#/$defs/contentKey" },
        "required": {
          "type": "boolean",
          "default": true,
          "description": "Does this marker count toward the unlock threshold? Defaults to true. Optional markers award progress but never block: the threshold is computed over solved-and-required markers only, so a level with no required marker at all is rejected by data/scripts/validate-levels.py."
        },
        "config": {
          "type": "object",
          "description": "Puzzle-type-specific settings, constrained per type by the allOf branches above. A type whose engine does not exist yet must carry no config — an authored setting no engine reads looks like it works and does not."
        },
        "dataRef": {
          "type": "string",
          "description": "The seam between Python output and the game: a JSON pointer into a file under data/generated/, e.g. 'orbital-positions.json#/earth'.",
          "pattern": "^[a-z0-9-]+\\.json#(/[A-Za-z0-9_-]+)*$"
        },
        "reward": {
          "type": "object",
          "additionalProperties": false,
          "properties": {
            "unlocks": {
              "type": "array",
              "items": { "type": "string" },
              "description": "Ids of things in the world that react when this is solved — a path lighting up, a door opening. Each must name something that exists: another marker id in this same level, or a level id that has data committed under src/scenes/. Enforced by data/scripts/validate-levels.py."
            },
            "fact": {
              "$ref": "#/$defs/contentKey",
              "description": "The short fact shown once the puzzle is solved."
            }
          }
        }
      }
    }
  }
}
